question_id,question_text,correct_answer,option1,option2,option3,category_id,difficulty
2093,Who composed the soundtrack for the game VVVVVV?,Magnus Pålsson,Terry Cavanagh,Danny Baranowsky,Joel Zimmerman,2,medium
2102,"In the game Dark Souls, what is the name of the region you're in for the majority of the game?",Lordran,Drangleic,Oolacile,Lordran,2,easy
2104,Which of these Generation 1 Pokemon did NOT have an evolution in Generation 4?,Jynx,Electabuzz,Magmar,Rhydon,2,hard
2107,"What was the game ""Galaga"" was a sequel to?",Galaxian,Galactica,Galaxian,Space Invaders,2,medium
2108,"Who is the victim mentioned in the second KG-8 incident, in Ace attorney Investigations, Case 4?",Deid Mann,Deid Mann,Frank Sahwit,Shey De Killer,2,hard
2109,"What is the hardest possible difficulty in ""Deus Ex: Mankind Divided""?",I Never Asked For This,Nightmare,Extreme,I Never Asked For This,2,easy
2111,"Lanky, Funky, and Chunky are all characters featured in which series owned by Nintendo?",Donkey Kong,Mario,Kirby,Zelda,2,easy
2112,What is the main character of Metal Gear Solid 2?,Raiden,Solidus Snake,Big Boss,Venom Snake,2,medium
2118,Which of these Counter-Strike maps is a bomb defuse scenario?,Prodigy,747,Havana,Oilrig,2,medium
2119,What company develops the Rock Band series of rhythm games?,Harmonix,Activision,Harmonix,Konami,2,easy
2124,"In the ARPG ""Path of Exile,"" what is the highest amount of sockets that an item can have?",6,6,5,4,2,medium
2125,The character Wario was first introduced in which game of the Mario video game franchise?,Super Mario Land 2: 6 Golden Coins (1992),Super Mario Bros. 3 (1988),Wario Land: Super Mario Land 3 (1994),Super Mario Land 2: 6 Golden Coins (1992),2,medium
2128,"When was the game ""Roblox"" released?",2006,2003,2006,2002,2,medium
2135,When was Nintendo's Virtual Boy released?,1995,1989,1995,1997,2,medium
2138,"In Animal Crossing: New Leaf, which of these paintings from Redd's Art Gallery is always genuine?",Warm Painting,Warm Painting,Jolly Painting,Neutral Painting,2,hard
2143,The starting pistol of the Terrorist team in a competitive match of Counter Strike: Global Offensive is what?,Glock-18,Glock-18,Tec-9,Desert Eagle,2,easy
2144,"In the Half-Life series, Gordon Freeman's signature weapon is a:",Crowbar,Sledgehammer,Fiber Wire,Katana,2,easy
2148,Which one of these is NOT an official map in Counter-Strike: Global Offensive?,de_season,de_sugarcane,de_season,de_canals,2,hard
2149,Pokémon Go is a location-based augmented reality game developed and published by which company?,Niantic,Rovio,Niantic,Zynga,2,easy
2155,"In the video game Undertale, what Fun Value is required to obtain the Fake Hallway?",66,91,45,66,2,hard
2160,Which of these TrackMania environments was NOT in the original game?,Bay,Desert,Snow,Bay,2,hard
2175,"In the Nintendo Game Splatoon 2, what is Marina's screen name?",DJ_Hyperfresh,DJ_Hyperfresh,MC.princess,Kidnotsquid123,2,hard
2178,"According to Toby Fox, what was the method to creating the initial tune for Megalovania?",Singing into a Microphone,Playing a Piano,Singing into a Microphone,Using a Composer Software,2,hard
2182,"""Rollercoaster Tycoon"" was programmed mostly entirely in...",x86 Assembly,C++,C,x86 Assembly,2,medium
2187,"In the ""Call Of Duty: Zombies"" map ""Origins"", how many steps are there to upgrade a Staff?",4,7,4,5,2,medium
2190,Which company did Bethesda purchase the Fallout Series from?,Interplay Entertainment,Interplay Entertainment,Capcom,Blizzard Entertainment,2,medium
2192,Which of these is NOT a faction included in the game Counter-Strike: Global Offensive?,BOPE,GSG-9,BOPE,Elite Crew,2,medium
2194,"In Super Mario Bros., who informs Mario that the princess is in another castle?",Toad,Luigi,Yoshi,Bowser,2,easy
2200,What was the world's first video game?,Tennis for Two,Spacewar!,Pong,Space Travel,2,hard
2205,Which of the following characters is NOT a female marriage candidate in the game Stardew Valley?,Caroline,Abigail,Caroline,Haley,2,easy
2207,"In Left 4 Dead, what is the name of the Special Infected that is unplayable in Versus mode?",The Witch,The Tank,The Witch,The Smoker,2,medium
2218,Danganronpa Another Episode: Ultra Despair Girls is set after which Danganronpa game?,Danganronpa: Trigger Happy Havoc,Danganronpa: Trigger Happy Havoc,Danganronpa 2: Goodbye Despair,Danganronpa V3: Killing Harmony,2,medium
2224,Which character was introduced to the Super Smash Bros franchise in Super Smash Bros Melee?,Sheik,Sheik,Samus,Lucas,2,easy
2228,"In Portal 2, how did CEO of Aperture Science, Cave Johnson, presumably die?",Moon Rock Poisoning,Accidentally sending a portal to the Moon,Slipped in the shower,Moon Rock Poisoning,2,easy
2229,"The cake depicted in Valve's ""Portal"" franchise most closely resembles which real-world type of cake?",Black Forest,Black Forest,Devil's Food,Molten Chocolate,2,medium
2230,"Who created the ""Metal Gear"" Series?",Hideo Kojima,Hiroshi Yamauchi,Shigeru Miyamoto,Hideo Kojima,2,easy
2232,What is the default alias that Princess Garnet goes by in Final Fantasy IX?,Dagger,Dirk,Dagger,Garnet,2,easy
2235,In the Kingdom Heart series who provides the english voice for Master Eraqus?,Mark Hamill,Mark Hamill,Jason Dohring,Jesse McCartney,2,medium
2257,"What vault in the video game ""Fallout 3"" is the home of multiple clones named Gary?",Vault 108,Vault 108,Vault 101,Vault 87,2,hard
2264,What snowy mob was added in Minecraft 1.10?,Polar bears,Polar bears,Eskimos,Penguins,2,medium
2267,"In the indie farming game ""Stardew Valley"", which NPC hates the ""prismatic shard"" item when received as a gift?",Haley,Abigail,Elliott,Lewis,2,hard
2268,"In the game ""Subnautica"", which feature was removed due to performance issues in 2016?",Terraforming,Building,Terraforming,Crafting,2,medium
2270,"In the Mario Kart and Smash Bros. Games, Princess Rosalina is considered what weight class?",Heavy,Heavy,Medium,Light,2,medium
2282,Which souls game was not directed by Hidetaka Miyazaki?,Dark Souls 2,Dark Souls 2,Demon Souls,Dark Souls,2,hard
2283,"In Forza Motorsport 6, which of these track-exclusive cars was NOT featured in the game, either originally with the game or added as DLC?",Aston Martin Vulcan,Aston Martin Vulcan,Ferrari FXX-K,McLaren P1 GTR,2,medium
2290,"In the original Mega Man series, who is Mega Man's arch nemesis?",Dr. Wily,Dr. Light,Dr. Bad,Mr. Z,2,easy
2296,"Who performed ""I Took A Pill In Ibiza""?",Mike Posner,Avicii,Robbie Williams,Harry Styles,3,easy
2297,From which country does the piano originate?,Italy,Germany,Austria,Italy,3,medium
2298,What is the first track on Kanye West's 808s & Heartbreak?,Say You Will,Say You Will,Welcome to Heartbreak,Street Lights,3,medium
2299,What is the name of the song by Beyoncé and Alejandro Fernández released in 2007?,Amor Gitano,Amor Gitano,La ultima vez,Rocket,3,hard
2300,What was Rage Against the Machine's debut album?,Rage Against the Machine,Evil Empire,Bombtrack,The Battle Of Los Angeles,3,easy
2301,Which of these is the name of an American psychedelic rock band formed in 2002 by Benjamin Goldwasser and Andrew VanWyngarden?,MGMT,MSTRKRFT,STRFKR,SBTRKT,3,medium
2302,What is the name of Rivers Cuomo's wife?,Kyoko Ito,Kyoko Ito,Yoko Ono,Kyary Pamyu Pamyu,3,easy
2303,Which of the following is not a studio album by the band Pink Floyd?,Moving Pictures,The Dark Side of the Moon,Moving Pictures,Wish You Were Here,3,easy
2304,Who won the 1989 Drum Corps International championships?,Santa Clara Vanguard,Blue Devils,Santa Clara Vanguard,The Academy,3,hard
2305,"Who wrote the song ""You Know You Like It""?",AlunaGeorge,AlunaGeorge,DJ Snake,Steve Aoki,3,hard
2306,"What is the English title of the vaporwave track ""リサフランク420 / 現代のコンピュー"" by Macintosh Plus (Vektroid)?",Lisa Frank 420 / Modern Computing,Smoke Weed 420 / Everyday,Lisa Frank 420 / Modern Computing,Make Your Move 420 / My Mind,3,hard
2307,"Which group performs the song ""Crash into Me""?",Dave Matthews Band,Phish,The Grateful Dead,Destiny's Child,3,easy
2308,'74–'75 is a 1993 single from the album Ring by what American band?,The Connells,R.E.M.,The Ocean Blue,The Connells,3,medium
2309,EDM producer Marshmello performs live wearing clothes and a marshmallow mask of what colour?,White,Black,Blue,Yellow,3,medium
2310,Which European capital city gives its name to a 1981 song by Ultravox?,Vienna,Berlin,Paris,Brussels,3,medium
2311,In what year was Taylor Swift born?,1989,1988,1987,1990,3,medium
2312,Which of the following bands is Tom DeLonge not a part of?,+44,Box Car Racer,Blink-182,Angels & Airwaves,3,medium
2313,"What is the name of the main character from the music video of ""Shelter"" by Porter Robinson and A-1 Studios?",Rin,Rem,Ren,Rin,3,medium
2314,"What was the name of singer Frank Ocean's second studio album, which was released on August 20, 2016?",Blonde,Brunette,Black,Blonde,3,easy
2315,"What was the subject of the 2014 song ""CoCo"" by American rapper O. T. Genasis?",Cocaine,Conan O'Brien,Cobalt(II) carbonate,Coconut cream pie,3,easy
2316,Who had a 1976 hit with the song 'You Make Me Feel Like Dancing'?,Leo Sayer,Leo Sayer,Elton John,Billy Joel,3,medium
2317,Who is the lead singer of The Lumineers?,Wesley Schultz,Wesley Schultz,Jeremiah Fraites,Jay Van Dyke,3,medium
2318,"Which artist collaborated with American DJ Dillon Francis to release the song 2016 ""Need You""?",NGHTMRE,LOUDPVCK,NGHTMRE,KRNE,3,medium
2319,"The song ""Twin Size Mattress"" was written by which band?",The Front Bottoms,The Front Bottoms,Twenty One Pilots,The Wonder Years,3,medium
2320,"What year was Min Yoongi from South Korea boy band ""BTS"" born in?",1993,1992,1995,1993,3,hard
2321,How many studio albums have the duo Daft Punk released?,4,1,5,4,3,easy
2322,"Who wrote the musical composition, ""Rhapsody In Blue""?",George Gershwin,Irving Berlin,Duke Ellington,Johnny Mandel,3,medium
2323,"What animal is featured on the cover of English electronic music group The Prodigy's album, ""The Fat of the Land""?",Crab,Crab,Fox,Elephant,3,medium
2324,Which music publication is often abbreviated to NME?,New Musical Express,New Metro Entertainment,New Musical Express,Next Musical Enterprise,3,easy
2325,Who is the lead singer of the British pop rock band Coldplay?,Chris Martin,Jonny Buckland,Guy Berryman,Will Champion,3,easy
2326,"Which novelty band was best known for their UK chart hits ""Combine Harvester"" and ""I Am a Cider Drinker"" in 1976?",The Wurzels,Goldie Lookin Chain,Bonzo Dog Doo-Dah Band,The Wurzels,3,medium
2327,"Who sings the rap song ""Secret Wars Part 1""?",The Last Emperor,MC Frontalot,The Last Emperor,Busdriver,3,hard
2328,"Which one of these songs did the group ""Men At Work"" NOT make?",Safety Dance,Safety Dance,Down Under,Who Can It Be Now?,3,easy
2329,Which of these is NOT a name of an album released by American rapper Pitbull?,Welcome to Miami,Welcome to Miami,Dale,Global Warming,3,medium
2330,"Which Aerosmith album featured ""Walk This Way""?",Toys in the Attic,Rocks,Toys in the Attic,Get Your Wings,3,medium
2331,"What song includes the words ""Numa Numa"" which was subject to a Viral Video in 2004?",Dragostea Din Tei,Dragostea Din Tei,Despacito,Gangnam Style,3,hard
2332,"Which of these Queen songs were sampled for the baseline in Vanilla ""Ice's Ice Ice Baby?""",Under Pressure,Don't Stop Me Now,Brighton Rock,Under Pressure,3,medium
2333,African-American performer Sammy Davis Jr. was known for losing which part of his body in a car accident?,Left Eye,Right Ear,Right Middle Finger,Nose,3,medium
2334,"Panic! At the Disco's sixth album ""Pray For The Wicked"" was released on which date?","June 22, 2018","May 9, 2018","June 22, 2018","March 13, 2018",3,hard
2335,Who is the frontman of Muse?,Matt Bellamy,Matt Bellamy,Dominic Howard,Thom Yorke,3,medium
2336,The 'In the Flesh' tour was used in support of what Pink Floyd album?,Animals,The Wall,Wish You Were Here,Animals,3,medium
2337,"Rick Astley's hit song ""Never Gonna Give You Up"" was released in what year?",1987,1985,1986,1988,3,medium
2338,"The ""K"" in ""K-Pop"" stands for which word?",Korean,Kenyan,Kazakhstan,Korean,3,easy
2339,Which song previously recorded by Elvis Presley was covered by UB40 with a reggae beat?,Can't Help Falling in Love,Jailhouse Rock,In the Ghetto,Wooden Heart,3,medium
2340,"What date is referenced in the 1971 song ""September"" by Earth, Wind & Fire?",21st of September,26th of September,23rd of September,24th of September,3,medium
2341,"The Red Hot Chili Pepper song ""Give It Away"" is from what album?",Blood Sugar Sex Magik,One Hot Minute,Blood Sugar Sex Magik,By the Way,3,easy
2342,"Who had a 1969 top 5 hit with the song,  'A Boy Named Sue'?",Johnny Cash,Bob Dylan,Willie Nelson,Johnny Cash,3,easy
2343,On which Beatles album would you find the song 'Eleanor Rigby'?,Revolver,Revolver,Help!,Rubber Soul,3,hard
2344,"Which band released the album ""Sonic Highways"" in 2014?",Foo Fighters,Coldplay,Nickelback,Foo Fighters,3,medium
2345,Which of these is NOT the name of an album released by English singer-songwriter Adele?,12,19,21,25,3,easy
2347,"Finish these lyrics from the 2016 song ""Panda"" by Desiigner: ""I got broads in _______"".",Atlanta,Savannah,Augusta,Atlanta,3,easy
2348,Which of these songs did Jimi Hendrix cover?,All of these songs,All of these songs,Sgt. Pepper's Lonely Hearts Club Band,All Along the Watchtower,3,medium
2349,"In an orchestra, what is the lowest member of the brass family?",Tuba,Trombone,Tuba,Contrabass,3,easy
2350,Which of these artists has NOT been a member of dancehall group Major Lazer?,Skrillex,Diplo,Jillionaire,Walshy Fire,3,medium
2351,"In what film was the Michael Jackson song ""Will You Be There"" featured?",Free Willy,Sleepless in Seattle,Men in Black,Free Willy,3,medium
2352,Who is the artist of the recent new album the Uncanny Valley?,Perturbator,Carpenter Brut,GOST,Dan Terminus,3,medium
2353,What is the real name of Canadian electronic music producer deadmau5?,Joel Zimmerman,Joel Zimmerman,Sonny Moore,Adam Richard Wiles,3,medium
2354,"The song ""Caramelldansen"" is commonly mistaken as a Japanese song, what language is the song actually sung in?",Swedish,Hungarian,Finnish,Swedish,3,medium
2355,In what year did US band Weezer release Weezer (The White Album)?,2016,2001,2008,2019,3,medium
2356,What was Radiohead's first album?,Pablo Honey,The Bends,Pablo Honey,Kid A,3,medium
2357,"Which Elton John hit starts with the line ""When are you gonna come down""?",Goodbye Yellow Brick Road,Rocket Man,Bennie and the Jets,Crocodile Rock,3,hard
2358,What album did Bon Iver release in 2016?,"22, A Million","Bon Iver, Bon Iver","22, A Million",Blood Bank EP,3,easy
2359,"Kanye West's ""Gold Digger"" featured which Oscar-winning actor?",Jamie Foxx,Alec Baldwin,Jamie Foxx,Dwayne Johnson,3,easy
2360,"On the cover of 'Abbey Road,' which of the Beatles is not wearing shoes?",Paul McCartney,Paul McCartney,Ringo Starr,John Lennon,3,medium
2361,"This album, now considered to be one of the greatest of all time, was a commercial failure when it was released.",The Velvet Underground and Nico,Abbey Road,Led Zeppelin IV,Pet Sounds,3,hard
2363,"Which of these is NOT a song on The Beatles' 1968 self titled album, also known as the White album?",Being For The Benefit Of Mr. Kite!,Being For The Benefit Of Mr. Kite!,Why Don't We Do It in the Road?,Everybody's Got Something to Hide Except Me and My Monkey,3,medium
2366,The key of sharps does the key of G# minor contain?,5,3,7,0,3,hard
2367,Which of these songs from American Idiot: The Musical was a previously unreleased Green Day song?,When It's Time,Are We The Waiting,Before The Lobotomy,Favorite Son,3,medium
2368,What was Daft Punk's first studio album?,Homework,Discovery,Homework,Random Access Memories,3,easy
2369,Which of these is NOT an album released by The Beatles?,The Wall,Abbey Road,Magical Mystery Tour,Revolver,3,medium
2370,When was Gangnam Style uploaded to YouTube?,2012,2013,2014,2012,3,easy
2371,Which of these Johns was murdered by gunshots outside the Dakota in New York in 1980?,John Lennon,Johnny Thunders,John Denver,John Lennon,3,medium
2372,"How many studio albums have the heavy metal band, 'Metallica' released in the period between 1983 and 2016?",10,7,10,9,3,medium
2373,Which of the following music bands is not from Finland?,Sabaton,Apocalyptica,Waltari,Lordi,3,medium
2374,The tuba is a part of which musical family?,Brass,Percussion,Strings,Woodwind,3,easy
2376,Which of these women is not a member of the Korean girl group TWICE?,Kang Seulgi,Myoui Mina,Kang Seulgi,Kim Dahyun,3,medium
2377,"What musician made the song ""F**kin` Perfect"" in 2010?",P!nk,P!nk,Mitis,Adam lambert,3,medium
2378,"Whose albums included ""Back in Black"" and ""Ballbreaker""?",AC/DC,Iron Maiden,Black Sabbath,Metallica,3,easy
2379,What album is the song 'New Slang' by The Shins found on?,"Oh, Inverted World","Oh, Inverted World",Wincing The Night Away,Chutes Too Narrow,3,hard
2380,What was the name of the rock band that Nobuo Uematsu formed that played songs from various Final Fantasy games?,The Black Mages,The Final Fantasies,The Espers,The Rock Summoners,3,hard
2381,"Which song on Daft Punk's ""Random Access Memories"" features Pharrell Williams?",Get Lucky,Doin' It Right,Get Lucky,Instant Crush,3,easy
2383,"In 2015, David Hasselhof released a single called...",True Survivor,True Fighter,Real Kung-Fury,True Survivor,3,medium
2385,"Which Iron Maiden album did the song ""Dream of Mirrors"" feature in?",Brave New World,Dance of Death,Brave New World,A Matter of Life and Death,3,medium
2386,"Who is the vocalist and frontman of rock band ""Guns N' Roses""?",Axl Rose,Kurt Cobain,Slash,Axl Rose,3,medium
2387,Chino Moreno is the lead singer of which alternative metal band?,Deftones,Tool,Korn,Type O Negative,3,hard
2388,Which Beatle led the way across the zebra crossing on the Abbey Road album cover?,John,Paul,George,John,3,medium
2390,"Which of these songs by artist Eminem contain the lyric ""Nice to meet you. Hi, my name is... I forgot my name!""?",Rain Man,Without Me,Kim,Square Dance,3,medium
2392,According to the RIAA: Which artist has sold the most albums by the million?,The Beatles,The Beatles,Elvis Presley,Michael Jackson,3,medium
2394,"Which of these songs is NOT in The Beatles' album ""Sgt. Pepper's Lonely Hearts Club Band""?",Strawberry Fields Forever,Getting Better,Strawberry Fields Forever,Fixing a Hole,3,medium
2396,"Moby, an American DJ, singer, and musician, achieved worldwide success for the 1999 release of which of the following albums?",Play,Play,Everything Is Wrong,Moby,3,medium
2397,"In the words of his 1973 song, Bob Dylan is ""knock, knock, knockin"" on which door?",Heaven's,Opportunity's,Angie's,Heaven's,3,easy
2398,Pete Townshend collaborated with which famous guitarist for an event at Brixton Academy in 1985?,David Gilmour,Jimmy Page,Mark Knopfler,Eric Clapton,3,hard
2399,"According to a Beatles song, who kept her face in a jar by the door?",Eleanor Rigby,Eleanor Rigby,Loretta Martin,Molly Jones,3,medium
2400,"Which famous rapper is featured in Jack Ü (Skrillex and Diplo)'s 2015 single called ""Febreze""?",2 Chainz,Kendrick Lamar,Future,2 Chainz,3,easy
2401,"Which English guitarist has the nickname ""Slowhand""?",Eric Clapton,Eric Clapton,Mark Knopfler,Jeff Beck,3,easy
2402,"The song ""Feel Good Inc."" by British band Gorillaz features which hip hop group?",De La Soul,De La Soul,Public Enemy,OutKast,3,medium
2405,What country did Shirley Bassey originate from?,Wales,America,England,Canada,3,medium
2406,What song by Tina Turner is the theme for Mad Max Beyond Thunderdome?,We Don't Need Another Hero,Let's Stay Together,We Don't Need Another Hero,What's Love Got To Do With It,3,medium
2407,"Which band had hits in 1972 with the songs ""Baby I'm A Want You"", ""Everything I Own"" and ""The Guitar Man""",Bread,America,Bread,Chicago,3,medium
2408,"The band Muse released their first album, Showbiz, in what year?",1999,1998,2000,2001,3,easy
2409,"What event inspired The Cranberries song ""Zombie"" ?",The Warrington Bombings,September 11 Attacks,The Warrington Bombings,The Manchester Arena Bombing,3,hard
2411,Who was the lead singer and frontman of rock band R.E.M?,Michael Stipe,Chris Martin,Thom Yorke,Michael Stipe,3,medium
2412,"Which year was the album ""Year of the Snitch"" by Death Grips released?",2018,2013,2017,2018,3,easy
2413,Brian May was the guitarist for which band?,Queen,Queen,Pink Floyd,Rolling Stones,3,easy
2414,What is not a wind instrument?,Viola,Viola,Oboe,Trombone,3,easy
2415,"When did The Beatles release the LP ""Please Please Me""?",1963,1970,1960,1969,3,medium
2416,"The 2016 song ""Starboy"" by Canadian singer The Weeknd features which prominent electronic artist?",Daft Punk,deadmau5,Disclosure,DJ Shadow,3,easy
2417,What M83 was featured in Grand Theft Auto V's radio?,Midnight City,Outro,Reunion,Midnight City,3,medium
2418,What is the opening track on Lorde's Pure Heroine?,Tennis Court,Team,Royals,400 Lux,3,medium
2419,What is the name of the second studio album released by American rapper Post Malone in 2018?,Beerbongs & Bentleys,Takin' Shots,Beerbongs & Bentleys,Rockstar,3,medium
2420,A Caixa Malacacheta is what kind of musical instrument which is commonly used in Latin American music?,Snare Drum,Snare Drum,Cow Bell,Bass Drum,3,hard
2423,"""Some people call me the space cowboy"" is the first line from what song?",The Joker,Fandango,The Joker,Take The Money and Run,3,easy
2424,Which of the following is NOT a song in BROCKHAMPTON's SATURATION album series?,LAMB,HOTTIE,LAMB,SWAMP,3,medium
2425,Who was walking like an Egyptian in 1981?,The Bangles,R.E.M.,The Ocean Blue,The Connells,3,medium
2426,Which album was released by Kanye West in 2013?,Yeezus,My Beautiful Dark Twisted Fantasy,The Life of Pablo,Watch the Throne,3,hard
2427,What was The Velvet Underground's first album called?,The Velvet Underground & Nico,The Velvet Underground & Nico,Loaded,The Velvet Underground,3,medium
2428,Which genre of Hip Hop does MC Frontalot rap?,Nerdcore,Nerdcore,Horrorcore,Christian,3,medium
2430,"The Who's eponymous line, ""Teenage Wasteland"", appears in which of their songs?",Baba O' Riley,The Seeker,Baba O' Riley,Won't Get Fooled Again,3,medium
2431,"The four strings on a violin are the G string, D string, A string, and...",E string,E string,C string,B string,3,easy
2433,Which country is singer Kyary Pamyu Pamyu from?,Japan,Japan,South Korea,China,3,medium
2434,"Which song in rapper Kanye West's album ""The Life of Pablo"" features Rihanna?",Famous,Wolves,Ultralight Beam,Highlights,3,hard
2435,What was Raekwon the Chefs debut solo album?,Only Built 4 Cuban Linx,Only Built 4 Cuban Linx,Shaolin vs Wu-Tang,The Wild,3,medium
2436,"How many copies have Metallica album ""Metallica"" (A.K.A The Black Album) sold worldwide (in Millions of Copies)?",20.5,19.5,22.5,25.5,3,medium
2438,"The 1952 musical composition 4'33"", composed by prolific American composer John Cage, is mainly comprised of what sound?",Silence,Farts,People talking,Silence,3,medium
2439,How many members are there in the band Nirvana?,Three,Three,Two,Four,3,easy
2440,Which of these is NOT a song featured on the Lockjaw EP released in 2013 by Flume & Chet Faker?,Left Alone,What About Us,This Song Is Not About A Girl,Drop The Game,3,hard
2442,Which of the following songs was not originally released by Sir Elton John?,You'll Be In My Heart,Crocodile Rock,Candle in the Wind,I Don't Wanna Go On With You Like That,3,easy
2443,"Johnny Cash did a cover of this song written by lead singer of Nine Inch Nails, Trent Reznor.",Hurt,Hurt,Closer,A Warm Place,3,medium
2446,Which of these is not a song on the album Graduation by Kanye West?,Waves,I Wonder,Big Brother,Waves,3,medium
2449,Which member of the Foo Fighters was previously the drummer for Nirvana?,Dave Grohl,Dave Grohl,Taylor Hawkins,Nate Mendel,3,easy
2450,Which of these artists do NOT originate from France?,The Chemical Brothers,The Chemical Brothers,Air,Justice,3,medium
2451,"Who was not in the band ""The Smiths""?",Martin Chambers,Morrissey,Martin Chambers,Andy Rourke,3,hard
2453,"Which of these languages was NOT included in the 2016 song ""Don't Mind"" by Kent Jones?",Portuguese,Japanese,French,Portuguese,3,medium
2454,The heavy metal band Black Sabbath hail from which English city?,Birmingham,Manchester,London,Birmingham,3,hard
2455,Which one of these artists appears in the album Deltron 3030?,Dan the Automater,Lamarr Kendrick,Danger Mouse,Dan the Automater,3,medium
2456,What is rapper Drake's real name?,Aubrey Graham,Shaun Carter,Dwayne Carter,Aubrey Graham,3,medium
2457,"Which of these artists did NOT feature in the fitfh studio album ""Humanz"" by British virtual band Gorillaz?",Snoop Dogg,Snoop Dogg,Vince Staples,Pusha T,3,hard
2459,"Which band had hits in 1975 with the songs, 'One Of These Nights' & 'Lyin Eyes'?",The Eagles,The Eagles,Fools Gold,The Doobie Brothers,3,medium
2461,Which one of these rappers is NOT a member of the rap group Wu-Tang Clan?,Dr.Dre,Ol' Dirty Bastard,Dr.Dre,GZA,3,medium
2462,"""Lift Your Spirit"" is an album by which artist?",Aloe Blacc,Lena Meyer-Landrut,Stevie Wonder,Aloe Blacc,3,medium
2463,What is the name of the 2016 studio album by the French electronic music duo Justice?,Woman,Randy,Woman,Safe and Sound,3,medium
2464,Who is the primary lyricist for Canadian progressive rock band Rush?,Neil Peart,Geddy Lee,Neil Peart,Alex Lifeson,3,medium
2465,"Madonna's song ""Hung Up"" includes a piece from which popular 70s song?",Gimmie! Gimmie! Gimme! (A Man After Midnight),Staying Alive,Night Fever,Gimmie! Gimmie! Gimme! (A Man After Midnight),3,medium
2466,What year was Huun Huur Tu's album Altai Sayan Tandy-Uula released?,2004,1993,2004,2006,3,hard
2468,"Björk's ""Unison"" contains a sample of which Oval song?",Aero Deck,Textuell,Panorama,Do While,3,hard
2469,Which term best describes the connection of two sections of a musical piece through a transitional passage?,Bridge,Coda,Bridge,Capo,3,easy
