question_id,question_text,correct_answer,option1,option2,option3,category_id,difficulty
1261,"Which one of the first four titles of the ""Grand Theft Auto"" franchise started the series of iconic image grid cover arts?",Grand Theft Auto III,Grand Theft Auto,Grand Theft Auto III,Grand Theft Auto II,2,medium
1262,"In ""Call Of Duty: Zombies"", ""Richtofen"" is in possession of two filled blood vials belonging to who?",Sal DeLuca and Finn O'Leary,Richtofen,Al Arlington and Sal DeLuca,Sal DeLuca and Finn O'Leary,2,hard
1263,From where does the Nintendo video game character Mario derive his name?,The landlord of the American headquarters,Shigeru Miyamoto's father in law,The landlord of the American headquarters,Satoru Iwata's plumber,2,medium
1271,Which soccer player is featured on the cover of EA Sport's FIFA 18?,Cristiano Ronaldo,Lionel Messi,Neymar,Harry Kane,2,medium
1272,Who is the main protagonist in Danganronpa 2: Goodbye Despair?,Hajime Hinata,Nagito Komaeda,Makoto Naegi,Hajime Hinata,2,easy
1273,Which of the following was a map that was in Team Fortress 2 at launch?,Gravel Pit,Hoodoo,Gold Rush,Upward,2,easy
1275,Which company developed and published Game Dev Tycoon?,Greenheart Games,Greenheart Games,Greenland Games,The Tycoonists,2,medium
1276,"In the fighting game ""Skullgirls,"" which character utilizes a folding chair called the ""Hurting"" as a weapon?",Beowulf,Big Band,Beowulf,Squigly,2,easy
1277,Who is the leader of Team Instinct in Pokémon Go?,Spark,Candela,Spark,Blanche,2,easy
1278,"In Final Fantasy XIV, what is the name of the Deep Dungeon that was introduced in the expansion pack, Heavensward?",Palace of the Dead,Heaven on High,Aetherochemical Research Facility,Palace of the Dead,2,easy
1281,What is the AK-47's name in Counter Strike: Source?,CV-47,AK-74,CV-47,AK,2,medium
1283,How many partners can you obtain in Paper Mario: The Thousand-Year Door?,7,6,9,10,2,hard
1285,What's the Team Fortress 2 Scout's city of origin?,Boston,Sydney,Detroit,Boston,2,easy
1287,"Before it's redesign of the company logo in the year 2000, which 3D shape is NOT represented in the Electronic Arts logo?",Cylinder,Pyramid,Cube,Cylinder,2,easy
1288,What type of Pokémon is Charizard?,Fire/Flying,Fire,Fire/Flying,Dragon,2,easy
1290,"According to the lore of ""Starbound"", what does the ""Colony Deed"" do when it is placed down?",Sends out an advertisement for someone to move in.,Teleports somebody from somewhere on the planet it is placed.,Sends out an advertisement for someone to move in.,Teleports a random person to the location.,2,hard
1291,What are the names of the Ice Climbers in the video game Ice Climber?,Popo and Nana,Popo and Nana,Popo and Nina,Papi and Nana,2,medium
1294,"In Fallout: New Vegas, upon starting each one of the four campaign DLCs, which one of them does not have a warning screen/recommended level?",Honest Hearts,Old World Blues,Honest Hearts,Lonesome Road,2,medium
1297,What ingredient is NOT used to craft a cake in Minecraft?,Bread,Bread,Wheat,Milk,2,easy
1298,"According to Overwatch's lore, who was once a member of the Deadlock Gang?",McCree,Roadhog,McCree,Soldier 76,2,medium
1299,"In Counter Strike: Global Offensive, what is the code implanted onto the C4 as the Terrorists plant the bomb?",7355608,7355608,7890728,7256380,2,hard
1300,"In ""Halo"", what is the name of the planet which Installation 04 orbits?",Threshold,Substance,Sanghelios,Threshold,2,hard
1301,"What is the name of the currency in the ""Animal Crossing"" series?",Bells,Sea Shells,Bells,Leaves,2,medium
1302,Which of these games was NOT a Nintendo Switch launch title in the United States?,Voez,Just Dance 2017,Snipperclips,Fast RMX,2,medium
1303,"Which of these features was added in the 1994 game ""Heretic"" that the original ""DOOM"" could not add due to limitations?",Looking up and down,Increased room sizes,Unlimited weapons,Highly-detailed textures,2,medium
1304,"What were the first two blocks in ""Minecraft""?",Grass and Cobblestone,Grass and Stone,Crafting Table and Cobblestone,Grass and Cobblestone,2,easy
1305,Which of these video game engines was made by the company Epic Games?,Unreal,Unity,Unreal,Game Maker: Studio,2,easy
1307,Which was the first M-rated video game developed by Squaresoft/Square Enix?,Parasite Eve,Final Fantasy VIII,Front Mission,Vagrant Story,2,hard
1308,"""The Potato Sack"" was a collection of indie games released on Steam in 2011 as a promotion for which game?",Portal 2,Left 4 Dead 2,Half-Life 3,Portal 2,2,easy
1309,"In the game Battleblock Theater, what was the name of the voice actor who voiced the narrator?",Will Stamper,Steve Blum,Richard Epcar,Yuri Lowenthal,2,easy
1310,"In the Mario series, which game introduced Mario's Backflip ability?",Donkey Kong (Gameboy),Super Mario 64,Super Mario 3D Land,Super Mario Galaxy,2,medium
1312,"In the game Danganronpa: Happy Trigger Havoc, the character Aoi Asahina's ultimate ability is what?",Ultimate Swimmer,Ultimate Swimmer,Ultimate Detective,Ultimate Gambler,2,hard
1314,When was the Sega Genesis released in Japan?,"October 29, 1988","October 29, 1988","August 14, 1989","November 30, 1990",2,medium
1316,"In ""Fallout 4"", what is the name of the dog you find at Red Rocket truck stop?",Dogmeat,Dogmeat,Sparky,Quazar,2,medium
1318,Which variant of the MP5 is depicted in Counter-Strike 1.6?,MP5N,MP5SD,MP5N,MP5K,2,hard
1321,What was the nickname of the original model for Half-Life's protagonist Gordon Freeman?,Ivan the Space Biker,Gordon the Space Biker,Ivan the Alien Biker,Gordon the Alien Biker,2,hard
1322,When was Final Fantasy XV released?,"November 29th, 2016","October 25th, 2016","December 31th, 2016","November 29th, 2016",2,medium
1325,"Which of these is the only fighter in the game ""Super Smash Bros. Melee"" capable of dealing damage with their taunt animation?",Luigi,Luigi,Mr. Game & Watch,Jigglypuff,2,medium
1326,"Which of the following is a class in the game ""Hearthstone""?",Priest,Priest,Sage,Cleric,2,easy
1328,"What's the name of the main protagonist in the ""Legend of Zelda"" franchise?",Link,Link,Mario,Zelda,2,easy
1329,"What is the name of the first boss the player encounters in the 2017 game, ""Little Nightmares""?",The Janitor,The Warden,The Janitor,The Caretaker,2,medium
1330,What is the full name of the protagonist from the SNES game Clock Tower?,Jennifer Simpson,Jennifer Barrows,Jennifer Simpson,Jennifer Cartwright,2,medium
1331,"Which Sonic the Hedgehog game was originally supposed to be packaged with Sonic 3, but was cut in half due to time constraints?",Sonic & Knuckles,Sonic 2,Sonic CD,Sonic 3D Blast,2,easy
1332,When was Left 4 Dead 2 released?,"November 17, 2009","November 17, 2009","May 3, 2008","November 30, 2009",2,easy
1333,What two characters from the game Undertale are never in a relationship or not related?,Frisk & Chara,Sans & Papyrus,Toriel & Asgore,Alphys & Undyne,2,medium
1334,"What name did ""Mario"", from ""Super Mario Brothers"", originally have?",Ossan,Jumpman,Mr. Video,Ossan,2,medium
1335,"In Grand Theft Auto V, what was Michael De Santa's former surname?",Townley,De Santos,Townley,Watson,2,easy
1336,"In ""Call Of Duty: Zombies"", which map introduced the perk ""PhD Flopper""?",Ascension,Moon,Call Of The Dead,Ascension,2,medium
1337,The original Planetside was released in North America on...,"May 20, 2003","June 17, 2001","September 29, 2003","January 14, 2005",2,medium
1338,"Which of these characters in ""Undertale"" can the player NOT go on a date with?",Toriel,Papyrus,Undyne,Alphys,2,hard
1339,Which of the following games has the most playable characters?,Timesplitters: Future Perfect,Mortal Kombat: Armageddon,Marvel Vs. Capcom 2,Timesplitters: Future Perfect,2,medium
1341,"In Grand Theft Auto: V, what wanted level does the player receive if they enter Zancudo Army Base north of Los Santos?",4,4,3,5,2,medium
1342,What was the name of the hero in the 80s animated video game 'Dragon's Lair'?,Dirk the Daring,Arthur,Dirk the Daring,Sir Toby Belch,2,hard
1343,"In ""Team Fortress 2"", how much health does a scout have when overhealed?",185,185,215,195,2,hard
1345,"In The Elder Scrolls: Oblivion, the horse that goes by the name Shadowmere is given by what guild?",Dark Brotherhood,Dark Brotherhood,Thieves,Fighters,2,easy
1346,Which of these is a type of monster found in Minecraft?,Skeleton,Skeleton,Werewolf,Vampire,2,easy
1348,Who is the main antagonist of Ori and the Blind Forest?,Kuro,Nibel,Kuro,Gumo,2,easy
1350,"In ""Sonic the Hedgehog 2"" for the Sega Genesis, what do you input in the sound test screen to access the secret level select?",The Lead Programmer's birthday,The Lead Programmer's birthday,"The first release date of ""Sonic the Hedgehog""",The date Sonic Team was founded,2,hard
1352,"Why were only only 300,000 copies of Uniracers were produced?","DMA Designs was sued by Pixar, preventing more copies from being produced",There was a disagreement between DMA Designs and Nintendo,It didn't sell well due to poor review scores,No public information is available,2,medium
1354,What was the original name of Crash Bandicoot?,Willie Wombat,Coco Bandicoot,Marvelous Mole,Willie Wombat,2,easy
1355,"In ""Call Of Duty: Zombies"", completing which map's easter egg will reward you with the achievement, ""Time Travel Will Tell""?",Shangri-La,Shangri-La,Ascension,Moon,2,medium
1356,"In the survival horror game, ""Cry of Fear,"" what was the name of Simon's close friend/potential love interest?",Sophie,Olivia,Sophie,Jessica,2,easy
1357,"Which of these symbols can be seen on the shirt of the 1993 video game character, Bubsy T. Bobcat?",An exclamation point,A question mark,The letter B,An exclamation point,2,medium
1359,"Which of these is NOT a playable character race in the video game ""Starbound""?",Fenerox,Floran,Novakid,Fenerox,2,medium
1360,Which Kirby game first introduced Copy Abilities?,Kirby's Adventure,Kirby Super Star,Kirby's Dream Land 2,Kirby's Dream Land,2,easy
1361,What CS:GO case contains the Butterfly Knife?,Breakout Case,Shadow Case,Vanguard Case,Breakout Case,2,medium
1362,"In the game ""Terraria"", which of these bosses are pre-hardmode bosses?",Eye of Cthulhu,Plantera,Skeletron Prime,Eye of Cthulhu,2,medium
1366,One of the Nintendo Entertainment System voice channels supports playback of sound samples. Which one?,DMC,Noise,DMC,Triangle,2,medium
1367,Which game was the first time Mario was voiced by Charles Martinet?,Mario's Game Gallery,Super Mario 64,Mario Tennis,Dr. Mario 64,2,medium
1368,"Which horror movie had a sequel in the form of a video game released in August 20, 2002?",The Thing,The Evil Dead,The Thing,Saw,2,medium
1369,"In the Video Game, Half-life, what type of US military force starts clearing out the Black Mesa Research Facility?",The HECU,Navy Seals,The Combine,The Marines,2,easy
1372,"Who is the villain company in ""Stardew Valley""?",Joja Co,Joja Co,Ronin,Empire,2,medium
1374,"In Diablo lore, this lesser evil spawned from one of the seven heads of Tathamet, and was known as the Maiden of Anguish.",Andariel,Valla,Malthael,Kashya,2,hard
1376,What is the protagonist's title given by the demons in DOOM (2016)?,Doom Slayer,Doom Slayer,Doom Guy,Doom Marine,2,easy
1378,In which Mario game did the Mega Mushroom make its debut?,Mario Party 4,New Super Mario Bros.,Mario Kart Wii,Super Mario 3D World,2,medium
1379,Who is the leader of Team Mystic in Pokémon Go?,Blanche,Candela,Blanche,Spark,2,easy
1382,What is the homeworld of the Elites from Halo?,Sanghelios,Te,Sanghelios,Doisac,2,hard
1383,"In the Super Mario Bros. Series, what is Yoshi's scientific name?",T. Yoshisaur Munchakoopas,Yoshi,T. Yoshisotop Munchakoopas,T. Yoshisaur Munchakoopas,2,hard
1385,How many people can you recruit in the game Suikoden in a single playthrough?,107,108,93,96,2,hard
1387,"In Overwatch, how old is Reinhardt Wilhelm?",61,59,61,65,2,medium
1388,"Half-Life by Valve uses the GoldSrc game engine, which is a highly modified version of what engine?",Quake Engine,Doom Engine,Quake Engine,id Engine,2,easy
1390,What is the most expensive weapon in Counter-Strike: Global Offensive?,Scar-20/G3SG1,M4A1,AWP,Scar-20/G3SG1,2,easy
1391,"Which pop singer was brought in by SEGA to produce the music for ""Sonic the Hedgehog 3""?",Michael Jackson,Prince,Michael Jackson,George Michael,2,medium
1392,"What is the name of the game developer who created ""Call Of Duty: Zombies""?",Treyarch,Sledgehammer Games,Infinity Ward,Treyarch,2,easy
1394,"In Cook, Serve, Delicious!, which food is NOT included in the game?",Pie,Pie,Shish Kabob,Hamburger,2,medium
1396,"In the Pokémon series, what is Palkia's hidden ability?",Telepathy,Pressure,Telepathy,Water Bubble,2,hard
1397,"What type of genre is the controversial 2015 game ""Hatred""?",Shoot 'Em Up,Point & Click,Shoot 'Em Up,MMORPG,2,medium
1400,"Which of the following Pokemon Types was present in the original games, Red and Blue?",Ice,Steel,Dark,Ice,2,easy
1401,Which one of these games came out first?,Terraria,Minecraft,Starbound,Factorio,2,medium
1402,In what city in the dystopia alternate future of Half-Life 2 do you first start in?,City 17,City 18,City 6,City 17,2,easy
1403,"In PROTOTYPE 2, which of the following abilities/weapons is NOT obtained by an Evolved?",Tendrils,Blade,Tendrils,Bio-Bomb,2,medium
1405,Which country is featured in Ace Combat 5: The Unsung War?,Osea,Aurelia,Australia,Osea,2,medium
1406,"In the ""Ace Attorney"" series, who was the truly responsible of the forging of the autopsy report of the pivotal IS-7 incident?",Bansai Ichiyanagi,Manfred Von Karma,Bansai Ichiyanagi,Gregory Edgeworth,2,hard
1407,"Which monster in ""Monster Hunter Tri"" was causing earthquakes in Moga Village?",Ceadeus,Alatreon,Ceadeus,Rathalos,2,hard
1408,How many obsidian blocks are required to build a nether portal in Minecraft?,10,10,14,13,2,easy
1409,"Which occupation did John Tanner, the main protagonist for Driver and Driver 2, had before turning into an undercover cop?",Racing Driver,Taxi Driver,Racing Driver,Delivery Driver,2,hard
1412,"Of the following space shooter games, which came out first?",Space Invaders,Galaxian,Galaga,Sinistar,2,medium
1413,The acronym DOTA stands for,Defense of the Ancients,Defense of the Artifacts,Defense of the Ancients,Defense of the Antiques,2,easy
1416,"In the game ""Overwatch,"" what are the names of the two Australian criminals from the Junkers faction?",Junkrat and Roadhog,Junkrat and Roadhog,Roadrat and Junkhog,Ana and Pharah,2,easy
1417,"The original mascot of the popular Nintendo game, ""Splatoon"" was going to be...",Mario,Inklings,Octolings,Zelda,2,medium
1419,"In ""Overwatch"", what is the name of Mercy's ""ultimate ability""?",Valkyrie,Valkyrie,Earthshatter,Rocket Barrage,2,medium
1420,"In the Animal Crossing series, which flower is erroneously called the ""Jacob's Ladder""?",Lily of the Valley,Hydrangea,Harebell,Lily of the Valley,2,hard
1425,"In ""Kingdom Hearts"", what is the name of Sora's home world?",Destiny Islands,Agrabah,Destiny Islands,Land of Departure,2,medium
1426,What is Pikachu's National PokéDex Number?,#025,#001,#031,#025,2,easy
1427,"In ""Call Of Duty: Zombies"", completing which map's main easter egg will reward you with the achievement, ""Little Lost Girl""?",Origins,Revelations,Moon,Tranzit,2,medium
1430,Which of the following Zelda games did not feature Ganon as a final boss?,Majora's Mask,Ocarina of Time,Skyward Sword,Breath of the Wild,2,easy
1431,Which of these characters from Final Fantasy VIII primarily spoke in one word sentences?,Fujin,Raijin,Seifer,Fujin,2,hard
1432,Which company is the one responsible for creating the strategy videogame Stellaris?,Paradox Development Studio,Overkill Software,Tripwire Interactive LLC,Ensemble Studios,2,easy
1433,"How many times do you fight Gilgamesh in ""Final Fantasy 5""?",6,6,4,5,2,easy
1436,"In the Mario Kart series, which game introduced the ""Shield Drifting"" mechanic?",Mario Kart Arcade GP DX,Mario Kart: Double Dash,Mario Kart Super Circuit,Mario Kart DS,2,hard
1438,"In World of Warcraft lore, who was first to have the title ""The Ashbringer""?",Alexandros Mograine,Alexandros Mograine,Tirion Fordring,Arthas Menethil,2,medium
1439,The “fairy” type made it’s debut in which generation of the Pokemon core series games?,6th,2nd,6th,7th,2,easy
1440,"In the ""Pikmin"" games, which of the following pikmin colors lacks it's own ""Onion"" nest?",Purple,Purple,Winged,Blue,2,hard
1441,"In Touhou 12: Undefined Fantastic Object, which of these was not a playable character?",Izayoi Sakuya,Hakurei Reimu,Kirisame Marisa,Kochiya Sanae,2,medium
1445,"Excluding their instructor, how many members of Class VII are there in the game ""Legend of Heroes: Trails of Cold Steel""?",9,6,10,3,2,medium
1447,Who's the voice actor for Thrall in the Warcraft game series?,Chris Metzen,Ben Affleck,Jason Derulo,Chris Metzen,2,easy
1448,"Which of these is the name of a cut enemy from ""Half-Life 2""?",Hydra,Cthulu,Hydra,Spike,2,medium
1449,"In Terraria, what does the Wall of Flesh not drop upon defeat?",Picksaw,Picksaw,Pwnhammer,Breaker Blade,2,medium
1451,What is the maximum HP in Terraria?,500,400,1000,500,2,easy
1452,"In Fallout 4, which type of power armor is first encountered in the early mission ""When Freedom Calls"" in a crashed Vertibird?",T-45,T-51,T-45,T-60,2,medium
1454,"In which order do you need to hit some Deku Scrubs to open the first boss door in ""Ocarina of Time""?","2, 3, 1","1, 2, 3","1, 3, 2","2, 1, 3",2,medium
1461,"In the ""Portal"" series, who was Cave Johnson's personal assistant?",Caroline,Heather,Caroline,Melissa,2,medium
1463,"In ""Starbound"", what is the max HP of the monster ""Punchy""?","50,000 HP","9,000,000 HP","50,000 HP",100 HP,2,hard
1465,"In ""Phoenix Wright: Ace Attorney"" which character is the District Chief of Police?",Damon Gant,Miles Edgeworth,Lana Skye,Damon Gant,2,easy
1466,"In the game ""Overwatch,"" which quote does the hero ""McCree"" NOT say upon using his flashbang ability?","""You done?""","""Whoa there.""","""You done?""","""Hold up now.""",2,hard
1470,"In ""Call Of Duty: Zombies"", completing which map's main easter egg will reward you with the achievement, ""High Maintenance""?",Die Rise,Mob Of The Dead,Die Rise,Origins,2,medium
1471,"Which franchise does the creature ""Slowpoke"" originate from?",Pokemon,Dragon Ball,Sonic The Hedgehog,Pokemon,2,easy
1472,"Which team won the ""Tom Clancy's Rainbow Six Siege"" Invitational Event February 2017 in the PC Category?",Continuum,Continuum,GIFU,Santos Dexterity,2,hard
1473,"Which of the following weapons in ""Counter-Strike: Global Offensive"" does not have a right-click function?",XM1014,SG553,XM1014,R8 Revolver,2,easy
1477,"In ""The Binding of Isaac"", which item instantly kills Mom and Mom's Heart?",The Bible,The Bible,The Halo,Brimstone,2,hard
1478,"In the world strategy game 'Sid Meier's Civilization', a programming bug caused the AI depiction of Gandhi to do which of the following?",Become aggressive and launch nuclear strikes,Begin speaking in German,Become friendly and trade his entire wealth,Become aggressive and launch nuclear strikes,2,medium
1479,Which of the following is not a character in the Street Fighter series?,Mai Shiranui,Laura Matsuda,Sakura Kasugano,Mai Shiranui,2,easy
1484,"In ""Resident Evil 2"", what is Leon Kennedy's middle name?",Scott,Shaun,Simon,Sam,2,medium
1486,"What happened to Half-Life 2 prior to its release, which resulted in Valve starting over the development of the game?",The source code got leaked,They weren't satisfied with the result,The story was not good enough,The source code got leaked,2,medium
1487,What was the first Call of Duty game to include the Zombies gamemode?,Call of Duty: World at War,Call of Duty: Black Ops,Call of Duty: Modern Warfare 2,Call of Duty: Black Ops III,2,medium
1488,"What is the main theme song of ""Sonic Adventure 2""?",Live and Learn,Open Your Heart,Live and Learn,Can You Feel the Sunshine?,2,hard
1497,Which of these is NOT the name of a team leader in Pokémon GO?,Leif,Blanche,Leif,Spark,2,medium
1498,"League of Legends, DOTA 2, Smite and Heroes of the Storm are all part of which game genre?",Multiplayer Online Battle Arena (MOBA),Real Time Strategy (RTS),First Person Shooter (FPS),Role Playing Game (RPG),2,easy
1499,"During the game's development, what was the first ever created Pokémon?",Rhyhorn,Bulbasaur,Rhyhorn,Mew,2,medium
1502,In what year were screenshots added to Steam?,2011,2010,2011,2008,2,medium
1504,"Counting the Blood and Wine DLC, how many Hero Cards are there in total in The Witcher 3?",25,30,20,15,2,hard
1508,What was the world's first handheld game device?,Mattel Auto Race,Mattel Auto Race,Game Boy,Microvision,2,hard
1512,What was the #1 selling game on Steam by revenue in 2016?,Sid Meier's Civilization VI,Grand Theft Auto V,Sid Meier's Civilization VI,Counter Strike: Global Offensive,2,medium
1513,What is the name of the island introduced in the ARMA III: APEX expansion pack?,Tanoa,Altis,Stratis,Tanoa,2,medium
1516,"In the video game Overwatch, which playable character is infamous for saying ""It's high noon.""?",McCree,Hanzo,Pharah,McCree,2,easy
1517,Which team won the first Overwatch League championship?,London Spitfire,Philadelphia Fusion,New York Excelsior,Seoul Dynasty,2,medium
1520,"Which popular First Person Shooter (FPS) franchise, got a Real Time Strategy (RTS) game developed based on its universe?",Halo,Battlefield,Call of Duty,Borderlands,2,easy
1521,"In Counter-Strike: Global Offensive, what's the rarity of discontinued skins called?",Contraband,Discontinued,Diminished,Limited,2,easy
1523,"In which location does Dark Sun Gwyndolin reside in ""Dark Souls""?",Anor Londo,Anor Londo,Firelink Shrine,Blighttown,2,medium
1529,"In what year was ""Super Mario Sunshine"" released?",2002,2002,2003,2000,2,medium
1531,"In which game did the character ""Mario"" make his first appearance?",Donkey Kong,Super Mario Bros.,Donkey Kong,Super Mario Land,2,hard
1533,This weapon in Counter-Strike: Global Offensive does not exist in real life.,M4A4,AWP,M4A1,M4A4,2,medium
1534,"What Ultimate does Makoto Naegi, protagonist of Danganronpa: Trigger Happy Havoc, have?",Ultimate Lucky Student,Ultimate Unlucky Student,Ultimate Lucky Student,Ultimate Detective,2,easy
1536,"What is the 4th boss in the 1997 video game ""Crash Bandicoot 2: Cortex Strikes Back""?",Dr. N. Gin,Dr. Neo Cortex,Komodo Brothers,Dr. N. Gin,2,hard
1537,"The protagonist of the hit game, Half-Life 2 is called:",Gordon Freeman,Alyx Vance,Isaac Kleiner,Wallace Breen,2,easy
1539,"In Divinity: Original Sin II, what is the name of the skeletal origin character?",Fane,Lohse,The Red Prince,There are no skeletal origin characters,2,easy
1542,"In vanilla Minecraft, which of the following cannot be made into a block?",Charcoal,Charcoal,Coal,Wheat,2,easy
1544,What is Gabe Newell's favorite class in Team Fortress 2?,Spy,Spy,Heavy,Medic,2,easy
1547,"How much did the indie game ""Cave Story"" cost when it was first released in 2004?",$0 USD,$0 USD,$5 USD,$10 USD,2,medium
1549,Which CS:GO eSports team won the major event ESL One Cologne 2016?,SK Gaming,Team Liquid,SK Gaming,Fnatic,2,medium
1550,Which Game Boy from the Game Boy series of portable video game consoles was released first?,Game Boy Color,Game Boy Advance,Game Boy Color,Game Boy Micro,2,easy
1552,"Who is the founder of Team Fortress 2's fictional company ""Mann Co""?",Zepheniah Mann,Zepheniah Mann,Cave Johnson,Wallace Breem,2,easy
1553,Which of these is NOT a Humongous Entertainment game franchise?,Commander Keen,Pajama Sam,Putt-Putt,Commander Keen,2,easy
1554,"Which artist composed the original soundtrack for ""Watch Dogs 2""?",Hudson Mohawke,Hudson Mohawke,Rustie,Machinedrum,2,hard
1557,"In the game Pokémon Conquest, how many kingdoms make up the region of Ransei?",17,18,15,16,2,medium
1558,"In ""Call Of Duty: Zombies"", which map's opening cutscene shows ""Richtofen"" killing another version of himself?",The Giant,Shadows Of Evil,The Giant,Der Eisendrache,2,hard
1559,"In the ""Halo"" series, what is the name of the race of aliens humans refer to as ""Grunts""?",Unggoy,Huragok,Unggoy,Sangheili,2,hard
1561,What is the name of the main island in PLAYERUNKNOWN'S BATTLEGROUNDS?,Erangel,Marmara,Erangel,Severny,2,hard
1562,Which of the following is NOT one of the main characters in Grand Theft Auto V’s story mode?,Tommy Vercetti,Michael de Santa,Tommy Vercetti,Franklin Clinton,2,easy
1563,Which of these characters was NOT planned to be playable for Super Smash Bros. 64?,Peach,Bowser,Mewtwo,King Dedede,2,medium
1566,Which game is NOT part of the Science Adventure series by 5pb. and Nitroplus?,Occultic; Nine,Steins; Gate,Robotics; Notes,Chaos; Child,2,medium
1568,"In the Gamecube Version of ""Resident Evil"" what text document is open on the monitor of the computer in the Visual Data Room?",A GDC Document,A GDC Document,Text Document on Herbs,Nothing,2,hard
1569,Which of the following created and directed the Katamari Damacy series?,Keita Takahashi,Hideki Kamiya,Shu Takumi,Keita Takahashi,2,medium
1570,"In the Pokémon series, which type is Sudowoodo, the Imitation Pokémon?",Rock,Rock,Grass,Bug,2,medium
1571,"How long was the World Record Speed Run of Valve Software's ""Half-Life"" that was done in 2014.","20 Minutes, 41 Seconds","45 Minutes, 32 Seconds","5 Minutes, 50 Seconds","12 Minutes, 59 Seconds",2,hard
1572,"Which character in Undertale tells you that you're ""gonna have a bad time""?",Sans,Sans,Undyne,Asgore,2,easy
1573,Which of these game franchises were made by Namco?,Tekken,Street Fighter,Tekken,Mortal Kombat,2,medium
1574,How many total monsters appear in Monster Hunter Generations?,105,100,98,73,2,hard
1577,"In the 2015 RPG ""Undertale"", which character do you first encounter after falling down into the underground?",Flowey,Toriel,Sans,Flowey,2,medium
1581,"In what year was the first ""Mass Effect"" game released?",2007,2008,2009,2010,2,easy
