question_id,question_text,correct_answer,option1,option2,option3,category_id,difficulty
1582,"Which Crypt of the NecroDancer (2015) character has a soundtrack by Jake ""Virt"" Kaufman?",Uncle Eli,Cadence,Nocturna,Octavian (Bard),2,medium
1587,"In ""Resident Evil 2"", which virus was William Birkin mutated by?",G-Virus,T-Virus,C-Virus,G-Virus,2,medium
1589,"Who is the protagonist of the videogame ""Dead Rising 2""?",Chuck Greene,Nick Ramos,Frank West,Chuck Greene,2,medium
1592,Who is the main villain of Kirby's Return to Dreamland?,Magolor,Magolor,Landia,King Dedede,2,medium
1593,What is the name of your team in Star Wars: Republic Commando?,Delta Squad,Delta Squad,The Commandos,Bravo Six,2,hard
1596,"In Left 4 Dead, what is the name of the virus, as designated by CEDA, that causes most humans to turn into the Infected?",Green Flu,Yellow Fever,T-Virus,Green Flu,2,medium
1597,"In the game Paper Mario for the Nintendo 64 the first partner you meet is a Goomba, what is its name?",Goombario,Goombella,Goombarry,Goombario,2,medium
1598,"In TF2 Lore, what are the names of the Heavy's younger sisters?",Yana and Bronislava,Yana and Bronislava,Gaba and Anna,Yanna and Gaba,2,hard
1599,"In the video game ""Team Fortress 2"", which class is able to double jump?",Scout,Spy,Scout,Engineer,2,easy
1600,"What was the name of the game created by Masahiro Sakurai and Satoru Iwata that would eventually evolve into ""Super Smash Bros.""?",Dragon King: The Fighting Game,Nintendo Legends: Fight!,Martial Arts: King of the Hill,Aerial Warriors: Supreme Battle,2,hard
1602,Which of the following is NOT an official game in Nintendo's Super Smash Bros. series?,Super Smash Bros. Crusade,Super Smash Bros. Melee,Super Smash Bros. Brawl,Super Smash Bros. Crusade,2,medium
1604,"In the ""Ace Attorney"" series, what is the relationship between Apollo Justice and Trucy Wright?",They're half-siblings,They're co-workers,They're half-siblings,They're friends,2,medium
1605,"In Skylanders Giants, why was Zaps' Wow Pow named ""For Riley"" ?",As a tribute to a fan who passed away,As a reference to a film,After one of the writers of the game,As a tribute to a fan who passed away,2,medium
1607,What was the name of the protagonist of Metal Gear Solid V: The Phantom Pain?,"Punished ""Venom"" Snake","Punished ""Venom"" Snake",Miller,Solid Snake,2,medium
1608,What is the name of the adventurer you meet at the mines in Stardew Valley?,Marlon,Marnie,Morris,Marvin,2,easy
1609,"In Need For Speed Most Wanted (2005), what do you drive at the beginning of the career mode?",BMW M3 GTR,BMW M3 GTR,Porsche 911 Turbo,Nissan 240SX,2,medium
1616,Which of these is NOT a playable character in the 2016 video game Overwatch?,Invoker,Mercy,Winston,Invoker,2,easy
1618,Which of the following games was NOT included in Valve's Orange Box?,Counter-Strike,Portal,Half-Life 2: Episode Two,Counter-Strike,2,hard
1620,"In the game ""DELTARUNE"", what is Ralsei's special ability?",Pacify,Persuade,Eliminate,Pacify,2,easy
1623,"Which of these is NOT a main playable character in ""Grand Theft Auto V""?",Lamar,Lamar,Trevor,Michael,2,easy
1625,What is the name of the City in Saints Row The Third?,Steelport,Stilwater,Carcer,Steelport,2,easy
1627,"Which one of these nations was added to Civilization V with the ""Gods & Kings"" expansion?",The Netherlands,The Netherlands,The Zulu,The Ottomans,2,medium
1629,Which of the following was NOT a playable character in the game Kingdom Hearts: Birth by Sleep?,Ignis,Ventus,Terra,Aqua,2,easy
1630,"In ""Undertale"", how many main endings are there?",3,2,5,13,2,easy
1634,"In the game ""Cave Story,"" what is the character Balrog's catchphrase?",Huzzah!,Yes!,Whoa there!,Huzzah!,2,medium
1636,"Who created the indie adventure game ""Night in the Woods""?",Alec Holowka,Ron Gilbert,Alec Holowka,Tim Schafer,2,easy
1639,"What system was ""Touhou: Highly Responsive to Prayers"" released on?",PC-98,OSX 10.9.5,Windows ME,PC-98,2,medium
1640,"What Touhou Project character's first ever appearance was as a midboss in the eighth game, Imperishable Night?",Tewi Inaba,Tewi Inaba,Mystia Lorelei,Kaguya Houraisan,2,hard
1641,"Who created the pump ""F.L.U.D.D."" Mario uses in Super Mario Sunshine?",Elvin Gadd,Robert Fludd,Elvin Gadd,Nirona,2,medium
1642,"What former MOBA, created by Waystone Games and published by EA, was shut down in 2014?",Dawngate,Strife,League of Legends,Heroes of Newerth,2,medium
1643,"In the ""Worms"" series of video games, which of these weapons is affected by wind?",Bazooka,Grenade,Bazooka,Air Strike,2,easy
1648,What is the name of the main character in the video game VA-11 HALL-A: Cyberpunk Bartender Action?,Jill,Dana,Jill,Alma,2,hard
1653,"In the game ""Undertale"", who was Mettaton's creator?",Alphys,Undyne,Sans,Alphys,2,medium
1654,What was the character Kirby originally going to be named?,Popopo,Dedede,Waddle Dee,Popopo,2,medium
1656,"Which of the following characters from the game ""Overwatch"" was revealed to be homosexual in December of 2016?",Tracer,Widowmaker,Tracer,Sombra,2,easy
1657,"Which Pokemon generation did the fan-named ""Masuda Method"" first appear in?",Diamond/Pearl,Diamond/Pearl,Ruby/Sapphire,Black/White,2,easy
1659,Which of these characters wasn't a villian in Club Penguin?,The Director,Herbert P. Bear,Tusk,Ultimate Proto-Bot 10000,2,hard
1660,Which character from the Mega Man series made a small cameo on Volt Catfish's introduction scene in CD versions of Mega Man X3?,Auto,Eddie,Tango,Rush,2,hard
1662,"When Halo 3: ODST was unveiled in 2008, it had a different title. What was the game formally called?",Halo 3: Recon,Halo 3: Recon,Halo 3: Helljumpers,Halo 3: Phantom,2,medium
1663,"In the 2000 video game ""Crimson Skies,"" what was the name of the protagonists' zeppelin?",Pandora,Helios,Icarus,Pandora,2,medium
1664,"What is the name of the first level in ""Call of Duty: World at War""?",Semper Fi,Ring of Steel,Semper Fi,Vendetta,2,medium
1667,"Which of these games takes place in the Irish town of Doolin, with the option to play as one of the characters, Ellen and Keats?",Folklore,Folklore,Shadow of the Colossus,ICO,2,medium
1671,"Which game in the ""Monster Hunter"" series introduced the ""Insect Glaive"" weapon?",Monster Hunter 4,Monster Hunter Freedom,Monster Hunter Stories,Monster Hunter 2,2,hard
1673,"In vanilla Minecraft, you can make armor out of all BUT which of the following?",Emeralds,Diamonds,Iron,Emeralds,2,medium
1676,Which one of these characters is NOT a playable fighter in Super Smash Bros. Ultimate?,Kumatora,King K. Rool,Incineroar,Kumatora,2,easy
1677,"Which of these is not a character in the game, ""Lethal League""?",Rex,Rex,Switch,Candyman,2,medium
1678,"Which of these blocks in ""Minecraft"" has the lowest blast resistance?",Sand,End Stone,Water,Wood Planks,2,medium
1680,Rocket League is a game which features..,Cars,Helicopters,Planes,Submarines,2,easy
1682,What was the first PlayStation game to require the use of the DualShock controller?,Ape Escape,Metal Gear,Tekken,Tomba 2!,2,medium
1683,"In ""Kingdom Hearts"", what mission are Donald and Goofy assigned by King Mickey?",To find the Key bearer and stick with him!,To find the Key bearer and stick with him!,To find the Key bearer and steal the key!,To find the Key bearer and report back!,2,medium
1684,"In the PAYDAY series, where did Dallas start his criminal career?","Chicago, Illinois","Dallas, Texas","Chicago, Illinois","New York City, New York",2,hard
1685,What numbers did Sayaka Maizono write on the wall in Dangan Ronpa Trigger Happy Havoc?,11037,"4, 8, 15, 16, 23, 42",55730,11037,2,medium
1691,"In ""Yo! Noid 2,"" The Noid can perform what special move?",Dab,Pizza Throw,Dodge Roll,Spin Dash,2,easy
1693,What video game genre were the original Warcraft games?,RTS (Real Time Strategy),RPG (Role Playing Game),TBS (Turn Based Strategy),MMO (Massively Multiplayer Online),2,medium
1695,"Which gaming series includes ""The Diabolical Box"" and ""The Curious Village""?",Professor Layton,Persona,Professor Layton,Etrian Odyssey,2,hard
1698,In which video game did Michael Fassbender star?,Fable 3,Fable 3,Call of Duty: Modern Warfare,Assassin's Creed 3,2,hard
1699,The most graphically violent game to precede the creation of the ESRB (Entertainment Software Rating Board) was...,Mortal Kombat,Duke Nukem,Resident Evil,Doom,2,easy
1700,The default playermodel of Garry's Mod is this Half Life 2 character.,Isaac Kleiner,G-Man,Alyx Vance,Gordon Freeman,2,medium
1705,"In Dota 2, what is Earthshaker's real name?",Raigor Stonehoof,Raigor Stonehoof,Banehallow Ambry,Carl,2,medium
1709,"In Portal 2, which solar system body did Wheatley end up orbiting?",The moon,Earth,The moon,Jupiter,2,medium
1714,"Which was the first ""Call Of Duty: Zombies"" map to introduce the ""Wunderwaffe DG-2""?",Shi No Numa,Tranzit,Kino Der Toten,Shi No Numa,2,medium
1715,"In the game ""Persona 4"", what is the canonical name of the protagonist?",Yu Narukami,Chino Mashido,Tunki Sunada,Yu Narukami,2,medium
1716,"Before Super Smash Bros. contained Nintendo characters, what was it known as internally?",Dragon King: The Fighting Game,Contest of Champions,Dragon King: The Fighting Game,Smash and Pummel,2,hard
1718,Who is the main antagonist in the Portal franchise?,GLaDOS,Chell,Wheatley,GLaDOS,2,easy
1719,Who is the last boss in Night In The Woods' Demontower minigame?,The Blood Thief,Mega Hairball,King Skellie,The Blood Thief,2,easy
1725,Which one of the following titles by Valve is not based on a Community Mod?,Ricochet,Day of Defeat,Counter-Strike,Alien Swarm,2,hard
1726,"Which of the following Copy Abilities was only featured in ""Kirby & The Amazing Mirror""?",Mini,Magic,Smash,Mini,2,medium
1728,"What is the name of ""Team Fortress 2"" update, in which it became Free-to-play?",Über Update,Pyromania Update,Über Update,Mann-Conomy Update,2,easy
1729,"In Five Nights at Freddy's 1, how can you make Golden Freddy disappear?",Enable cameras,Turn on the light,Shut the door,Enable cameras,2,easy
1734,"Which of these operators from ""Tom Clancy's Rainbow Six Siege"" has the ability to damage reinforced walls?","Jordan ""Thermite"" Trace","Eliza ""Ash"" Cohen","Seamus ""Sledge"" Cowden","Dominic ""Bandit"" Brunsmeier",2,medium
1738,"In ""Starbound"", according to the asset files, the description of the ""Erchius Ghost"" is the same as which other assets?",Spookit,Spookit,Petricub,Trictus,2,hard
1742,"In the title of the game ""Luigi's Mansion"", what is the only letter to not appear with a pair of eyes in it?",s,s,n,i,2,hard
1743,"How many regular Sunken Sea Scrolls are there in ""Splatoon""?",27,32,30,5,2,medium
1744,"In Call Of Duty: Black Ops II, who is the main antagonist?",Raul Menéndez,Vladimir Makarov,Frank Woods,Raul Menéndez,2,medium
1746,How many permanent companions are there in the base game version of Fallout: New Vegas?,8,7,9,6,2,medium
1748,Gordon Freeman is said to have burnt and destroyed what food in the break room microwave?,Casserole,Sub Sandwich,Chicken Soup,Pepperoni Pizza,2,easy
1749,"In most FPS video games such as Counter-Strike, shooting which part of the body does the highest damage?",Head,Arm,Leg,Chest,2,easy
1751,Which Mario spin-off game did Waluigi make his debut?,Mario Tennis,Mario Party 3,Mario Tennis,Mario Kart: Double Dash!!,2,easy
1753,"In the game ""Red Dead Redemption"", what is the name of John Marston's dog?",Rufus,Rutus,Rufus,Finn,2,medium
1755,In what engine was Titanfall made in?,Source Engine,Frostbite 3,Source Engine,Unreal Engine,2,medium
1756,When was the original Star Wars: Battlefront II released?,"October 31, 2005","December 18, 2004","November 21, 2006","September 9, 2007",2,medium
1757,"In CoD: Black Ops III, what is the name of the rogue A.I. antagonist?",Corvus,Cabal,Corvus,Legion,2,easy
1763,"When was the top-down online RPG ""Space Station 13"" released?",2003,2003,2000,2010,2,easy
1767,When was Minecraft first released to the public?,"May 17th, 2009","May 17th, 2009","September 17th, 2009","November 18th, 2011",2,easy
1771,"In ""PUBATTLEGROUNDS"" which ammo type does the M24 use?",7.62mm,7.62mm,5.56mm,9mm,2,easy
1775,"When was the video game publisher ""Ubisoft"" founded ?",March 1986,April 1990,June 2001,August 1956,2,medium
1777,"If you play the Super Mario RPG and nap in a rented hotel room, you will wake up next to what familiar looking character?",Link,Link,Wario,Q*bert,2,medium
1783,Who published the 1998 video game Half-Life?,Sierra On-Line,Valve,Blizzard,Sierra On-Line,2,medium
1787,"Which town was Seamus ""Sledge"" Cowden from ""Tom Clancy's Rainbow Six Siege"" born in?",John O'Groats,Brawl,Kearvaig,John O'Groats,2,medium
1789,"Which of the following characters is NOT playable in ""Resident Evil 6""?",Jill Valentine,Jill Valentine,Chris Redfield,Sherry Birkin,2,medium
1791,"In Left 4 Dead, what is the character Bill's last name?",Overbeck,Fish,Overbeck,Roberts,2,hard
1793,"In ""Overwatch"", Coalescence is the name for the ultimate of which hero?",Moira,Zenyatta,Torbjorn,Moira,2,medium
1795,"Which of these characters was almost added into Super Smash Bros. Melee, but not included as the game was too far in development?",Solid Snake,Pit,Meta Knight,Solid Snake,2,medium
1796,"Which of these characters does not appear in ""Nier: Automata""?",A1,A1,A2,9S,2,medium
1799,Why was the character Trevor Philips discharged from the Air Force?,Mental Health Issues,Mental Health Issues,Injuries,Disease,2,hard
1800,What is a Tetris piece called?,Tetromino,Tetromino,Tetratile,Tetris,2,medium
1808,"Who created the 2011 Video Game ""Minecraft""?",Markus Persson,Markus Persson,Jens Bergensten,Daniel Rosenfeld,2,easy
1813,Which of these covert groups employs Sam Fisher to work as a Splinter Cell?,Third Echelon,Third Echelon,Voron,Black Arrow,2,easy
1814,"Which operation in ""Tom Clancy's Rainbow Six Siege"" introduced the ""Skyscraper"" map?",Red Crow,Velvet Shell,Skull Rain,Red Crow,2,medium
1817,"What was the first game in the ""Battlefield"" series?",Battlefield 1942,Battlefield Vietnam,Battlefield 2,Battlefield 1,2,easy
1821,"What is the perk that was introduced in the ""Call Of Duty: Zombies"" map, ""Mob Of The Dead""?",Electric Cherry,Quick Revive,Vulture Aid,Tombstone,2,medium
1824,Which of the following is a character in the video game Destiny?,Cayde-6,Ostrava of Boletaria,Mordecai the Hunter,Leon S. Kennedy,2,medium
1825,Which of these is NOT a team available in the game Pokémon Go?,Team Rocket,Team Instinct,Team Valor,Team Mystic,2,easy
1826,What was the first Super Mario game ever released in North America for the 3DS?,Super Mario 3D Land,Super Mario 3D Land,Super Mario Maker,New Super Mario Bros. 2,2,medium
1829,"In the 2002 video game ""Kingdom Hearts"", how many Keyblades are usable?",18,13,18,16,2,easy
1830,"In World of Warcraft lore, who organized the creation of the Paladins?",Alonsus Faol,Uther the Lightbringer,Alonsus Faol,Alexandros Mograine,2,hard
1832,"Which ""Perk-A-Cola"" in ""Call Of Duty: Zombies"" was ""reworked"" in ""Call of Duty: Black Ops II""?",Double Tap Root Beer,Who's Who,Juggernog,Mule Kick,2,medium
1836,"In the game ""Hearthstone"", what is the best rank possible?",Rank 1 Legend,Rank 1 Legend,Rank 1 Elite,Rank 1 Master,2,easy
1837,"In the ""Call Of Duty: Zombies"" map ""Moon"", there is a secondary called the QED. What does QED stand for?",Quantum Entanglement Device,Quad Ectoplasmic Driver,Question Every Dog,Quantum Entanglement Device,2,medium
1841,When was the game 'Portal 2' released?,2011,2014,2009,2007,2,easy
1847,What is Solid Snake's real name?,David,Solid Snake,David,John,2,medium
1848,Which of these is NOT a name of a city in the main island of PLAYERUNKNOWN'S BATTLEGROUNDS?,Belushya Guba,Yasnaya Polyana,Pochinki,Georgopol,2,medium
1851,"In ""Call of Duty: Black Ops III"" Zombies, what does completing all the main easter eggs reward you with?","1,000,000 XP","1,000,000 XP",Juggernog at the start of each game,50 Liquid Diviniums,2,medium
1854,Who is the half-demon character in Divinity: Original Sin 2 who you talk to to transition between acts?,Malady,Meister Siva,Malady,Gawin,2,medium
1855,Which of the following is not a character in the video game Doki Doki Literature Club?,Nico,Monika,Natsuki,Sayori,2,easy
1861,"What's the name of the halloween-related Sims 4 Stuff Pack released September 29th, 2015?",Spooky Stuff,Ghosts n' Ghouls,Nerving Nights,Fearful Frights,2,hard
1862,"Ellen McLain, the voice of GLaDOS in the Portal game series, is married to the voice actor for which Team Fortress 2 character?",Sniper,Sniper,Heavy,Soldier,2,medium
1872,Which of these games was the earliest known first-person shooter with a known time of publication?,Spasim,Spasim,Doom,Wolfenstein,2,medium
1876,What song is played during the ending credits of Guitar Hero: World Tour?,Dream Theater - Pull Me Under,King Crimson - 21st Century Schizoid Man,Dream Theater - Pull Me Under,Dragonforce - Through The Fire & The Flames,2,medium
1879,Which drive form was added into Kingdom Hearts II Final Mix?,Limit Form,Limit Form,Valor Form,Wisdom Form,2,hard
1884,"In Stardew Valley, what is the reward for completing all of the Bulletin Board bundles?",Additional Friendship points,Glittering Boulder removed,Bus is repaired,Additional Friendship points,2,hard
1892,Which of the following has Jennifer Taylor NOT voiced?,Sarah Kerrigan,Princess Peach,Sarah Kerrigan,Zoey,2,medium
1896,"In the 1980s, a service called Gameline allowed users to download games to what console?",Atari 2600,Sega Genesis,Nintendo Entertainment System,ColecoVision,2,medium
1899,"In the PAYDAY series, who betrayed the PAYDAY gang that got Hoxton arrested?",Hector,Hector,Vlad,The Dentist,2,easy
1903,How many games in the Crash Bandicoot series were released on the original Playstation?,5,4,3,5,2,easy
1904,"In the ""PAYDAY"" series, what is the real name of the character known as ""Dallas""?",Nathan Steele,Nathan Steele,Nate Siemens,Nick Stamos,2,hard
1905,Which of the following commercial vehicles from Grand Theft Auto IV did NOT reappear in Grand Theft Auto V?,Steed,Steed,Mule,Benson,2,hard
1914,"Where does ""The Legend of Zelda: Majora's Mask"" take place?",Termina,Termina,Hyrule,Gysahl,2,medium
1915,"When was ""System Shock"" released?",1994,1994,1995,2000,2,medium
1916,What was the name of Sonic the Hedgehog's original human girlfriend?,Madonna,Celeste,Madonna,Sierra,2,hard
1917,"Which weapon that was cut from the game ""Half Life 2"" was going to replace the crowbar?",Ice Axe,Ice Axe,Fire Axe,Wrench,2,medium
1919,"In ""Call Of Duty: Zombies"", which map features the ""Fly Trap"" easter egg?",Der Riese,Tranzit,Der Riese,Call Of The Dead,2,medium
1920,"In the ""Devil May Cry"" franchise, which game is chronologically first?",Devil May Cry 3: Dante's Awakening,Devil May Cry 4,Devil May Cry,Devil May Cry 2,2,hard
1923,"In ""Mario & Sonic at the Olympic Games"", characters are split into how many types?",4,6,5,3,2,easy
1927,Who is the protagonist in Dead Rising (2006)?,Frank West,Chuck Greene,Frank West,John North,2,easy
1928,"Who voices the infamous Citadel Station A.I known as S.H.O.D.A.N, in the System Shock games?",Terri Brosius,Jennifer Hale,Jenn Taylor,Terri Brosius,2,medium
1931,Which football player is featured on the international cover version of the video game FIFA 16?,Lionel Messi,Cristiano Ronaldo,Wayne Rooney,David Beckham,2,medium
1932,What do the video games No Man’s Sky and Mighty No. 9 have in common?,Both were announced in 2013.,Both were crowdfunded.,Both were developed by indie studios.,Both were announced in 2013.,2,hard
1933,Which of the following is NOT a Nintendo game console?,Dreamcast,SNES,Wii,Dreamcast,2,easy
1934,"In the popular MOBA League of Legends, which of the following champions is nicknamed ""the Virtuoso""?",Jhin,Kayle,Jhin,Ezreal,2,hard
1947,When was Pokemon GO released in North America?,"July 6th, 2016","June 5th, 2016","July 6th, 2016","May 24th, 2016",2,hard
1953,"The protagonist in the game ""Cave Story"" is named",Quote,Quote,Kazuma,Curly,2,medium
1954,Which Dota 1 hero changed gender when ported to Dota 2?,Legion Commander,Axe,Keeper of the Light,Legion Commander,2,medium
1958,"Which game won the ""Games for Impact"" award in The Game Awards 2015?",Life is Strange,Ori and the Blind Forest,Life is Strange,Rocket League,2,medium
1961,What is the name of the final boss in Turok: Dinosaur Hunter?,The Campaigner,The Primagen,Oblivion,The Campaigner,2,medium
1969,"In the game Warframe, what Mastery Rank do you need to have to build the Tigris Prime?",13,6,18,13,2,hard
1973,"Which franchise was NOT featured in the 2015 video game ""Lego Dimensions""?",Breaking Bad,Portal,Doctor Who,Back to the Future,2,easy
1982,"In ""PAYDAY 2"", what weapon has the highest base weapon damage on a per-shot basis?",HRL-7,Heavy Crossbow,HRL-7,Thanatos .50 cal,2,medium
1985,When was the Valve Corporation founded?,"August 24, 1996","December 26, 1994","March 22, 1997","August 24, 1996",2,hard
1987,"In the Zombies mode of ""Call of Duty: Black Ops"", what is the ""Pack-A-Punched"" version of the ""Galil"" called?",Lamentation,Lamentation,Galvanized Atomic Lead Insertion Liquidator,Gabig,2,hard
1990,"In the game series ""The Legend of Zelda"", what was the first 3D game?",Ocarina of Time,Majora's Mask,A Link to the Past,The Wind Waker,2,medium
1993,Who is Sonic's sidekick?,Tails,Tails,Shadow,Amy,2,easy
1996,"In which game does a character say, ""Sometimes, I dream about cheese""?",Half Life 2,Half Life 2,Team Fortress 2,Dark Souls,2,medium
1997,Which franchise had a special event hosted in the popular MMORPG Final Fantasy XIV: A Realm Reborn?,Yo-kai Watch,Pokémon,Yu-gi-oh,Buddyfight,2,medium
1999,What was the main currency in Club Penguin?,Coins,Stamps,Tickets,Gems,2,medium
2000,Which Sonic the Hedgehog game introudced Knuckles the Echidna?,Sonic the Hedgehog 3,Sonic the Hedgehog 2,Sonic the Hedgehog 3,Sonic & Knuckles,2,medium
2002,"""Strangereal"" is a fictitious Earth-like world for which game series?",Ace Combat,Jet Set Radio,Deus Ex,Crimson Skies,2,hard
2005,Which of these Starbound races has a Wild West culture?,Novakid,Avian,Human,Hylotl,2,easy
2006,"During development of ""Super Mario World"", Yoshi's hard saddle was originally which of these?",A shell,A slide of Gelatin,A shell,A poffin,2,hard
2014,In what year were achivements added to Steam?,2007,2008,2007,2009,2,medium
2019,Which of these is NOT a terrorist faction in Counter-Strike (2000)?,Midwest Militia,Phoenix Connection,Midwest Militia,Elite Crew,2,medium
2020,"Psych-Horror ""Eternal Darkness: Sanity's Requiem"", developed by Silicon Knights in 2002, was published by who and on what platform?",Nintendo® Co. Ltd. | GameCube™,Sony® Computer Entertainment™ Inc. | PlayStation® 2,Microsoft® Game Studios™ | XBox™,Nintendo® Co. Ltd. | GameCube™,2,medium
2021,"When was Chapter 1 of the Source Engine mod ""Underhell"" released?","September 1st, 2013","March 3rd, 2011","September 12th, 2013","September 1st, 2013",2,medium
2025,"In ""Call Of Duty: Zombies"", what does the game traditionally reward you for completing a boss round?",Max Ammo,A Pack-A-Punched gun,Max Ammo,Death Machine,2,hard
2028,Who was Tetris created by?,Alexey Pajitnov,Toru Iwatani,Alexey Pajitnov,Allan Alcorn,2,medium
2029,Which of these is NOT a map included in the game Counter-Strike: Global Offensive?,Oilrig,Assault,Mirage,Cache,2,easy
2032,"In the Fallout series, on which date did The Great War happen?","October 23rd, 2077","May 15th, 2058","December 14th, 2069","October 23rd, 2077",2,hard
2036,Which of the following games in the The Legend of Zelda franchise was released in Japan before North America?,The Legend of Zelda: The Minish Cap,The Legend of Zelda: Twilight Princess,The Legend of Zelda: Spirit Tracks,The Legend of Zelda: Four Swords,2,hard
2039,"In Night in the Woods, which instrument did Casey play?",Drums,Bass,Drums,Piano,2,medium
2040,"In which mall does ""Dead Rising"" take place?",Willamette Parkview Mall,Willamette Parkview Mall,Liberty Mall,Twin Pines Mall,2,easy
2041,On which planet does the game Freedom Planet (2014) take place?,Avalice,Freedom,Avalice,Galaxytrail,2,medium
2044,"In World of Warcraft Lore, four Old Gods created a giant and powerful creature. What was it called?",The Ancient One,Anomalous,Eater of Souls,The Ancient One,2,medium
2046,"In which ""Call of Duty"" game are the ""Apothicons"" introduced in the Zombies mode?",Call Of Duty: Black Ops III,Call Of Duty: Black Ops III,Call Of Duty: Black Ops,Call Of Duty: World At War,2,medium
2048,"In Overwatch, which ape species is the hero Winston?",Gorilla,Gorilla,Orangutan,Chimpanzee,2,easy
2049,What does Solid Snake use to hide himself with?,Cardboard Box,Cloaking Device,Metal Crate,Cardboard Box,2,easy
2050,When was Steam first released?,2003,2003,2004,2011,2,hard
2052,"In the original ""Super Mario Bros."", what is the acceleration of Mario if he was in free fall?",91.28 m/s^2,110  m/s^2,91.28 m/s^2,9.42  m/s^2,2,hard
2053,Which of the four empires in  Eve Online was the first to achieve faster than light travel?,Amarr Empire,Caldari State,Gallente Federation,Amarr Empire,2,hard
2073,"In the ""Metal Gear Solid"" series, what's the name of Solid Snake's brother?",Liquid Snake,Kulus Snake,Billy Snake,Gilur Snake,2,easy
2074,"""Gimmick!"" is a Japanese Famicom game that uses a sound chip expansion in the cartridge. What is it called?",FME-7,VRC7,VRC6,MMC5,2,hard
2076,"In the Team Fortress 2 canon, what did Shakespearicles NOT invent?",Stairs,Two-Story Building,Stairs,Rocket Launcher,2,hard
2086,"In Super Smash Bros. for Nintendo 3DS and Nintendo Wii U, who was the sixth fighter to be added to the game post-launch?",Corrin,Cloud,Bayonnetta,Ryu,2,hard
2089,"In Disney's ""Toontown Online"", which of these species wasn't available as a Toon?",Cow,Monkey,Cow,Bear,2,hard
2092,"When was the video game ""P.A.M.E.L.A."" released on Steam?","March 9, 2017","January 7, 2007","March 9, 2017","October 23, 1997",2,medium
